{
  "schema_version": "0.25.0",
  "topic_id": "physical.atmosphere",
  "review_after_hours": 48,
  "labs": [
    {
      "id": "global-circulation-lab",
      "section_id": "pep-selective-1-ch03-s02",
      "title": "三圈环流与气压带风带实验室",
      "subtitle": "从受热差异和地转偏向出发，把气压带成因、垂直运动、近地面风和季节移动连起来。",
      "visual_type": "circulation",
      "model_note": "图示为不考虑海陆分布和地形影响的理想模式；气压带位置随太阳直射点季节移动，并非固定在某一条纬线上。",
      "questions": [
        {"key": "target_belt", "label": "目标纬度附近的气压带", "choices": ["赤道低压带", "副热带高压带", "副极地低压带", "极地高压带"]},
        {"key": "pressure_origin", "label": "该气压带的主要成因", "choices": ["热力低压", "动力高压", "动力低压", "热力高压"]},
        {"key": "vertical_motion", "label": "中心垂直运动", "choices": ["上升", "下沉"]},
        {"key": "surface_relation", "label": "近地面风带关系", "choices": ["南北半球信风辐合", "低纬侧信风、中纬侧西风分别流出", "盛行西风与极地东风辐合", "极地东风从高压带流出"]},
        {"key": "seasonal_position", "label": "相对二分日的季节位置", "choices": ["接近平均位置", "北半球夏季整体偏北", "北半球冬季整体偏南"]}
      ],
      "error_tags": {
        "A-CIRC-BELT": "气压带定位错误",
        "A-CIRC-ORIGIN": "热力与动力成因混淆",
        "A-CIRC-VERTICAL": "垂直运动方向混淆",
        "A-CIRC-WIND": "风带辐合或辐散关系混淆",
        "A-CIRC-SEASON": "气压带风带季节移动方向混淆"
      },
      "scenarios": [
        {
          "id": "AC-01", "name": "二分日赤道附近", "context": "太阳直射点接近赤道，观察赤道附近近地面气流与垂直运动。", "season": "equinox", "target_latitude": 0, "contrast_key": "热力低压",
          "answers": {"target_belt": "赤道低压带", "pressure_origin": "热力低压", "vertical_motion": "上升", "surface_relation": "南北半球信风辐合", "seasonal_position": "接近平均位置"}
        },
        {
          "id": "AC-02", "name": "北半球夏季副热带", "context": "北半球夏季，观察副热带环流单元的下沉支及其两侧近地面风。", "season": "north-summer", "target_latitude": 30, "contrast_key": "动力高压",
          "answers": {"target_belt": "副热带高压带", "pressure_origin": "动力高压", "vertical_motion": "下沉", "surface_relation": "低纬侧信风、中纬侧西风分别流出", "seasonal_position": "北半球夏季整体偏北"}
        },
        {
          "id": "AC-03", "name": "二分日北纬60°附近", "context": "观察较暖的盛行西风与寒冷的极地东风在北纬60°附近相遇。", "season": "equinox", "target_latitude": 60, "contrast_key": "动力低压",
          "answers": {"target_belt": "副极地低压带", "pressure_origin": "动力低压", "vertical_motion": "上升", "surface_relation": "盛行西风与极地东风辐合", "seasonal_position": "接近平均位置"}
        },
        {
          "id": "AC-04", "name": "北半球冬季极地", "context": "北半球冬季，观察高纬寒冷空气收缩下沉及近地面极地东风。", "season": "north-winter", "target_latitude": 90, "contrast_key": "热力高压",
          "answers": {"target_belt": "极地高压带", "pressure_origin": "热力高压", "vertical_motion": "下沉", "surface_relation": "极地东风从高压带流出", "seasonal_position": "北半球冬季整体偏南"}
        }
      ]
    },
    {
      "id": "monsoon-system-lab",
      "section_id": "pep-selective-1-ch03-s02",
      "title": "海陆气压中心与季风实验室",
      "subtitle": "先判海陆冷暖和高低压，再判断东亚、南亚季风的风向、性质与形成链。",
      "visual_type": "monsoon",
      "model_note": "图示突出亚洲大陆与太平洋、印度洋之间的气压差异。真实季风还会受高原、地形和海温等因素影响。",
      "questions": [
        {"key": "season", "label": "北半球季节", "choices": ["北半球冬季", "北半球夏季"]},
        {"key": "continent_center", "label": "亚洲大陆主要气压中心", "choices": ["亚洲高压（冷高压）", "亚洲低压（热低压）"]},
        {"key": "ocean_center", "label": "北太平洋主要气压中心", "choices": ["副极地低压较显著", "副热带高压较强"]},
        {"key": "regional_wind", "label": "目标区域盛行风及性质", "choices": ["东亚西北季风，寒冷干燥", "东亚东南季风，温暖湿润", "南亚东北季风，干燥为主", "南亚西南季风，温暖湿润"]},
        {"key": "causal_chain", "label": "主要形成链", "choices": ["海陆热力差异使海陆气压中心随季节更替", "南半球东南信风越过赤道后右偏，并叠加海陆热力差异"]}
      ],
      "error_tags": {
        "A-MONSOON-SEASON": "季节判断错误",
        "A-MONSOON-PRESSURE": "海陆高低压中心判断错误",
        "A-MONSOON-OCEAN": "北太平洋气压中心混淆",
        "A-MONSOON-WIND": "季风风向或性质混淆",
        "A-MONSOON-CAUSE": "季风形成原因层级混淆"
      },
      "scenarios": [
        {
          "id": "AM-01", "name": "1月东亚季风", "context": "亚洲大陆降温快，东亚近地面风由大陆吹向太平洋。", "region": "east-asia", "season_key": "winter", "contrast_key": "冬季",
          "answers": {"season": "北半球冬季", "continent_center": "亚洲高压（冷高压）", "ocean_center": "副极地低压较显著", "regional_wind": "东亚西北季风，寒冷干燥", "causal_chain": "海陆热力差异使海陆气压中心随季节更替"}
        },
        {
          "id": "AM-02", "name": "7月东亚季风", "context": "亚洲大陆升温快，北太平洋副热带高压西侧暖湿气流吹向东亚。", "region": "east-asia", "season_key": "summer", "contrast_key": "夏季",
          "answers": {"season": "北半球夏季", "continent_center": "亚洲低压（热低压）", "ocean_center": "副热带高压较强", "regional_wind": "东亚东南季风，温暖湿润", "causal_chain": "海陆热力差异使海陆气压中心随季节更替"}
        },
        {
          "id": "AM-03", "name": "1月南亚季风", "context": "南亚位于亚洲高压南侧，近地面气流由大陆吹向印度洋。", "region": "south-asia", "season_key": "winter", "contrast_key": "冬季",
          "answers": {"season": "北半球冬季", "continent_center": "亚洲高压（冷高压）", "ocean_center": "副极地低压较显著", "regional_wind": "南亚东北季风，干燥为主", "causal_chain": "海陆热力差异使海陆气压中心随季节更替"}
        },
        {
          "id": "AM-04", "name": "7月南亚季风", "context": "南半球东南信风越过赤道后，在北半球向右偏转并吹向印度低压。", "region": "south-asia", "season_key": "summer", "contrast_key": "夏季",
          "answers": {"season": "北半球夏季", "continent_center": "亚洲低压（热低压）", "ocean_center": "副热带高压较强", "regional_wind": "南亚西南季风，温暖湿润", "causal_chain": "南半球东南信风越过赤道后右偏，并叠加海陆热力差异"}
        }
      ]
    },
    {
      "id": "climate-control-lab",
      "section_id": "pep-selective-1-ch03-s03",
      "title": "气压带风带与气候成因实验室",
      "subtitle": "从控制系统、垂直运动或水汽来向出发，连续判断降水季节、气候类型与自然景观。",
      "visual_type": "climate-control",
      "model_note": "图示突出教材中的一般规律；真实气候还会受海陆位置、地形、洋流和尺度差异共同影响。",
      "questions": [
        {"key": "controller", "label": "主导控制系统", "choices": ["赤道低压带全年控制", "副热带高压带全年控制", "盛行西风全年控制", "副热带高压带与西风带交替控制", "季风环流季节转换", "赤道低压带季节移动控制"]},
        {"key": "air_process", "label": "关键气流或水汽过程", "choices": ["上升气流易凝结", "下沉气流不易凝结", "海洋暖湿西风输入", "夏季下沉、冬季海洋西风", "海陆风向和水汽输入季节反转", "雨带随季节南北移动"]},
        {"key": "precipitation", "label": "降水季节特征", "choices": ["全年多雨", "全年少雨", "全年湿润且较均匀", "夏季少雨、冬季多雨", "夏季多雨、冬季少雨", "干湿季分明"]},
        {"key": "climate_type", "label": "典型气候类型", "choices": ["热带雨林气候", "热带沙漠气候", "温带海洋性气候", "地中海气候", "亚热带季风气候", "热带草原气候"]},
        {"key": "landscape", "label": "典型景观或生态响应", "choices": ["常绿热带雨林", "荒漠", "温带落叶阔叶林或草地", "常绿硬叶林", "亚热带常绿阔叶林", "湿季草长、干季草枯并伴动物迁徙"]}
      ],
      "error_tags": {
        "A-CLIMATE-CONTROL": "主导气压带或风带判断错误",
        "A-CLIMATE-PROCESS": "垂直运动或水汽来向判断错误",
        "A-CLIMATE-PRECIP": "降水季节分配判断错误",
        "A-CLIMATE-TYPE": "气候类型与成因链不匹配",
        "A-CLIMATE-LANDSCAPE": "气候与自然景观联系错误"
      },
      "scenarios": [
        {
          "id": "CL-01", "name": "亚马孙平原赤道附近", "context": "全年受赤道低压带影响，空气辐合上升。", "latitude_label": "赤道附近", "mode": "rising", "season_key": "all-year-wet", "contrast_key": "单一低压控制",
          "answers": {"controller": "赤道低压带全年控制", "air_process": "上升气流易凝结", "precipitation": "全年多雨", "climate_type": "热带雨林气候", "landscape": "常绿热带雨林"}
        },
        {
          "id": "CL-02", "name": "撒哈拉沙漠腹地", "context": "全年主要受副热带高压带控制，盛行下沉气流。", "latitude_label": "约20°—30°N", "mode": "sinking", "season_key": "all-year-dry", "contrast_key": "单一高压控制",
          "answers": {"controller": "副热带高压带全年控制", "air_process": "下沉气流不易凝结", "precipitation": "全年少雨", "climate_type": "热带沙漠气候", "landscape": "荒漠"}
        },
        {
          "id": "CL-03", "name": "欧洲西部沿海", "context": "中纬大陆西岸全年盛行从海洋吹来的西风。", "latitude_label": "约40°—60°N西岸", "mode": "ocean-wind", "season_key": "even-wet", "contrast_key": "全年西风控制",
          "answers": {"controller": "盛行西风全年控制", "air_process": "海洋暖湿西风输入", "precipitation": "全年湿润且较均匀", "climate_type": "温带海洋性气候", "landscape": "温带落叶阔叶林或草地"}
        },
        {
          "id": "CL-04", "name": "地中海沿岸", "context": "约30°—40°大陆西岸夏季受副热带高压带、冬季受西风带控制。", "latitude_label": "约30°—40°N西岸", "mode": "alternating", "season_key": "winter-wet", "contrast_key": "交替控制",
          "answers": {"controller": "副热带高压带与西风带交替控制", "air_process": "夏季下沉、冬季海洋西风", "precipitation": "夏季少雨、冬季多雨", "climate_type": "地中海气候", "landscape": "常绿硬叶林"}
        },
        {
          "id": "CL-05", "name": "我国南方季风区", "context": "大陆东岸海陆热力差异使冬夏季盛行风和水汽输入显著转换。", "latitude_label": "约25°—35°N东岸", "mode": "monsoon", "season_key": "summer-wet", "contrast_key": "季风控制",
          "answers": {"controller": "季风环流季节转换", "air_process": "海陆风向和水汽输入季节反转", "precipitation": "夏季多雨、冬季少雨", "climate_type": "亚热带季风气候", "landscape": "亚热带常绿阔叶林"}
        },
        {
          "id": "CL-06", "name": "塞伦盖蒂草原", "context": "赤道低压带随太阳直射点移动，雨带在一年中南北往返。", "latitude_label": "赤道附近热带草原", "mode": "migrating", "season_key": "wet-dry", "contrast_key": "雨带移动",
          "answers": {"controller": "赤道低压带季节移动控制", "air_process": "雨带随季节南北移动", "precipitation": "干湿季分明", "climate_type": "热带草原气候", "landscape": "湿季草长、干季草枯并伴动物迁徙"}
        }
      ]
    },
    {
      "id": "climate-graph-lab",
      "section_id": "pep-selective-1-ch03-s03",
      "title": "气温曲线与降水柱状图判读实验室",
      "subtitle": "先看最热月判半球，再看年温差与降水季节分配，最后用大气环流解释气候类型。",
      "visual_type": "climate-graph",
      "model_note": "图中数据为便于训练而整理的代表性月值，不代替气象站正式多年平均资料。先描述图形证据，再命名气候。",
      "questions": [
        {"key": "hemisphere", "label": "半球位置", "choices": ["赤道附近，半球特征不明显", "北半球", "南半球"]},
        {"key": "temperature", "label": "气温特征", "choices": ["全年高温", "夏热冬温", "夏热冬冷", "全年温和，年温差较小"]},
        {"key": "precipitation", "label": "降水分配", "choices": ["全年多雨", "全年少雨", "全年湿润且较均匀", "夏季少雨、冬季多雨", "夏季多雨、冬季少雨"]},
        {"key": "climate_type", "label": "气候类型", "choices": ["热带雨林气候", "热带沙漠气候", "温带海洋性气候", "地中海气候", "温带季风气候"]},
        {"key": "main_cause", "label": "主要大气环流成因", "choices": ["赤道低压带控制", "副热带高压带控制", "全年受海洋西风影响", "副热带高压带与西风带交替", "冬夏季风交替"]}
      ],
      "error_tags": {
        "A-GRAPH-HEMISPHERE": "未用最热月判断半球",
        "A-GRAPH-TEMPERATURE": "气温水平或年温差概括错误",
        "A-GRAPH-PRECIP": "降水季节分配概括错误",
        "A-GRAPH-TYPE": "气候图与气候类型匹配错误",
        "A-GRAPH-CAUSE": "气候图与环流成因脱节"
      },
      "scenarios": [
        {
          "id": "CG-01", "name": "新加坡代表性气候图", "context": "接近赤道，观察全年气温与降水的共同特征。", "city": "新加坡", "contrast_key": "全年高温多雨", "monthly_temperature": [26, 27, 27, 28, 28, 28, 28, 28, 28, 27, 27, 26], "monthly_precipitation": [240, 170, 190, 170, 170, 160, 150, 170, 190, 210, 260, 280],